"","x"
"1","作者asd840721 (君<U+306B><U+5C4A><U+3051>)看板movie標題[好雷] 屍速列車 重要的是選擇時間Sat Oct  1 23:40:00 2016

看到一個同學在臉書分享屍速列車的文，

內文打

找老公不一定要找帥的，至少要有擔當。

但現在連醜的都沒擔當，人生好難。


雖然只是個玩笑話，

但片裡馬東錫演的胖大叔跟孔侑帥老爸都很值得擔當這兩個字。

胖大叔一開始跟老婆要逃到車廂時，

遇到孔侑這個帥爸爸，

因為孔侑本來就是自私的人，

原本想直接把門關上，

後來胖大叔指責他自私，

再加上女兒對他說：

爸爸你就是每次都只想著自己，媽媽才會離開你


之後，孔侑便轉變了。


在後面逃跑的時候都不再只求自己，

而是努力幫助大家逃離殭屍，

這個部分是我全片最喜愛的部分，

因為它代表人性的轉變。





人性有善的一面，也有惡的一面。


如果說胖大叔代表的是光明，

那麼不斷利用別人而求生的容錫就是黑暗。

胖大叔在全片的態度都非常一致，

他就是保持著能多救一人是一人，

甚至到最後為了讓自己懷孕的老婆能平安，

而選擇請孔侑帶他老婆走，犧牲自己抵擋僵屍。



對照組的容錫一開始在等洗手間的時候看到流浪漢，

便跟孔侑女兒說：

你以後要好好念書，不然長大就會變這樣。


這句話透露了很多人常常用社會階級的高低來輕視別人，

甚至覺得別人是惡的。

容錫在片中不停地推別人去死以求自己平安：

女學生、車掌、男乘務員



「你們怎知道他們沒有被感染？

我們不能開門讓他們進來。」


也因為這樣自私的想法，害死了胖大叔，

原本大家都可以一起進來的。





流浪漢跟容錫這組之間的對比也很有趣。


流浪漢在最後車子失速打滑壓住另一輛列車的時候，

選擇犧牲自己爭取時間，

讓胖大叔老婆跟帥老爸的女兒能夠逃離車廂下。



一個是犧牲別人拯救自己的容錫、

一個是犧牲自己拯救別人的流浪漢，

儘管社會階級有那麼大的差距，

每個人在面對良善的選擇時，都是平等的。




孔侑帥老爸讓我忍不住想起鄧不利多說過的一句話：


「表現我們真正的自我，是我們自己的選擇，

這遠比我們所具有的能力更重要。」



我覺得孔侑老爸的這個腳色就是這句話的具體體現，



選擇的重要。



這是我最愛這個腳色的原因。


這段話也是哈利波特裡我最喜歡的一段話：

「It is our choices, Harry,

that show what we truly are,

far more than our abilities.」




--
※ 發信站: 批踢踢實業坊(ptt.cc), 來自: 59.127.55.129
※ 文章網址: https://www.ptt.cc/bbs/movie/M.1475336405.A.EE0.html
推 peterboysh01: 我是覺得孔劉太笨了啦 他被誣賴有感染的 10/02 01:06
→ peterboysh01: 時候 說一句我剛也咬了你一口不就沒事了 10/02 01:06
推 coco840727: 人家大叔是壯啦QQ 10/02 06:31
推 pureself: 推 選擇的重要 10/02 09:55
推 cornbar: good! 10/02 11:00
"
